limits to the extent permitted in Table 1 of this specification.,,,,,,,,,of Steel Products
1.3 Supplementary Requirements S 1 to S 10 are provided for,,,,,,,,,A788/A788M Specification for Steel Forgings, General Re­
use when additional testing or inspection is desired. These shall,,,,,,,,,quirements
apply only when specified individually by the purchaser in the,,,,,,,,,A965/A965M Specification for Steel Forgings, Austenitic,
order.,,,,,,,,,for Pressure and High Temperature Parts
,,,,,,,,,E165/El65M Practice for Liquid Penetrant Testing for Gen-
1.4 Unless the order specifies the applicable "M" specifica­,,,,,,,,,
,,,,,,,,,eral Industry
tion designation, the material shall be furnished to the inch­,,,,,,,,,
pound units.,,,,,,,,,2.2 ASME Boiler and Pressure Vessel Code:4
1.5 Specification A336/A,,336M formerly included austenitic,,,,,,,Section III Nuclear Power Plant Components
steel forgings,,which,are now,found in Specification A965/,,,,,,Section IX Welding and Brazing Qualifications
A965M.,,,,,,,,,2.3 AWS Specifications:5
1.6 The values stated in either SI units or inch-pound units,,,,,,,,,A5.5/A5.5M Low-Alloy Steel Electrodes for Shielded Metal
are to be regarded separately as standard. The values stated in,,,,,,,,,Arc Welding
each system are not necessarily exact equivalents; therefore, to,,,,,,,,,A5.23/A5.23M Low-Alloy Steel Electrodes and Fluxes for
ensure conformance with the standard, each system shall be,,,,,,,,,Submerged Arc Welding
used independently,of the,other,,and,values,from,the,two,,A5.28/A5.28M Low-Alloy Steel Electrodes for Gas
