to be agreed upon with the purchaser. However, the foundry adjacent plugs shall not be less than listed in Table 4. Other
is responsible for the satisfactory pe1formance of the cast­ defective areas may also be repaired by plugging provided
ings under the final hydrostatic test. the minimum ligament between plugs in adjacent areas is
not less than twice the distance from the nearest plug, the
values for which are listed in Table 4.
8. Workmanship and Finish
9. 3 Surface imperfections in castings Grade 60-40-18
8.1 The surface of the casting shall be examined visu­
other than valves, flanges, pipe fittings, pumps, and other
ally and shall be free from adhering sand, scale, cracks,
piping components may be repaired by plugging provided
and hot tears. Any other surface discontinuities shall meet
the depth of the plug is not greater than 20% of the thickness
visual acceptance standards specified in the order.
of the casting section and the diameter of the plug is not
greater than its length. Repair of surface defects may not
be done on pressure-containing portions of castings. The
9. Repair
plug need not be threaded. The conditions of 9.2.1 and
9.1 Castings for valves, flanges, pipe fittings, pumps,
9.2.4 shall also be satisfied.
and other piping components ordered under applicable
ANSI standards shall not be repaired by plugging, welding,
brazing, or impregnation.
10. Sampling
9.2 Castings Grade 60-40-18 not covered in 9.1 which 10.1 A lot shall consist of one of the following:
leak on hydrostatic tests may be repaired by plugging,
provided the following requirements are met: 10.1.1 All the metal from a single heating in a batch­
type melting furnace.
9.2.1 No welding or brazing is permitted.
10.1.2 All the metal poured from two or more batch­
9.2.2 The diameter of the plug shall not exceed the
type melting furnaces into a single ladle or a single casting.
diameter of a standard 2 in. [ISO R2] pipe plug.
All the metal poured from a continuous melt­9.2.3 The plugs, where practical, shall conform in 10.1.3
ing furnace for a given period of time between changes in all dimensions to the standard ISO 3⁄4p lugs. In addition,
charge, processing conditions, or aim-for chemistry, or 8 h, they shall have full thread engagement corresponding to
whichever is the shorter period. the thickness in the repaired section. Where a tapered plug
is impractical because of the excess wall thickness in terms
of plug diameter and coincident thread engagement, other
types of plugs may be used provided both full engagement 11. Test Coupon
and effective sealing against pressure are obtained. Where 11.1 The separately cast test coupons poured from the
possible, the ends of the plug should be ground smooth after same lot as the castings they represent from which the
installation to conform to the inside and outside contours of tension test specimen is machined shall be cast to the size
