4.1.11 Application and processing.,specimen shall conform to the applicable requirements in,
,Table 1.,
NOTE 2-A typical ordering description is as follows: 10 000 lb, [5000,,
kg] Hot Wrought Special Quality Carbon Steel Bars, 1 in. diameter X,7.1.1.2 Shapes less than 1 in.2 [645 mm2] in cross,
10 ft, [25 m x 3 m] Round, AS1M A 675/A 675M dated __ , Grade,section and bars (other than flats) less than1⁄2 in. [12.5 mm],
50, [345] Copper Bearing, Test Report Required, S3 Special Straightness,,in thickness or diameter need not be subject to,tension
Boiler Supports.,,
,tests by the manufacturer.,
,7.1.1.3 For material over3⁄4 in. [19 mm] in thick­,
5. Materials and Manufacture,ness or diameter, a deduction of 0.25% from the percentage,
5.1 Melting Practice - The steel shall be made by one,of elongation in 8 in. [200 mm] specified in Table 1 shall,
or more of the following primary processes: open-hearth,,be made for each increase of 1⁄22 in. [0.8 mm] in the specified,
basic-oxygen, or electric-furnace. The primary melting,thickness or diameter above3⁄4 in. [19 mm].,
may incorporate separate degassing or refining and may,7.1.1.4 For material under 1fo in. [8 mm] in thick­,
be followed by secondary melting using electroslag remelt­,ness or diameter, a deduction of 2.00% from the percentage,
ing or vacuum-arc remelting. Where secondary melting is,of elongation in 8 in. [200 mm] specified in Table 1 shall be,
employed, the heat shall be defined as all of the ingots,made for each decrease of 1⁄22 in. [0.8 mm] in the specified,
remelted from a single primary heat.,thickness or diameter below 3/i6 in. [8 mm].,
5.2 Deoxidation:,7.1.1.5 For Grades 45, 50, 55, 60, and 65,[310,
5.2.1 Unless otherwise specified, the steel shall be,345, 380, and 415) for material over 2 in.,[50 mm] in
rimmed, capped, semi-killed, or killed at the producer's,thickness or diameter, a deduction of 1.00% from the per­,
option.,centage of elongation in 2 in. [50 mm] specified in Table 1,
5.2.2 When required, the purchaser may specify the,shall be made for each 1 in. [25 mm] of specified thickness,
required deoxidation practice, dependent upon strength,or diameter or fraction thereof over,2 in. [50 mm] in
grade specified, purchaser's methods of fabrication, and,thickness or diameter.,
end use requirements. Killed steels can be produced to,7.1.1.6 For Grades 70, 75, 80, and 90 [485, 515,,
coarse or fine austenitic grain size (Supplementary Require­,550 and 620] for material over 2 in. [50 mm] in thickness,
ment Sl).,or diameter, a deduction of 1.00% from the percentage of,
5.3 Condition - Unless otherwise specified, the bars,elongation in 2 in. [50 mm] specified in Table 1 shall be,
shall be furnished as-rolled and not pickled, blast cleaned,,made for each 1 in. [25 mm] of specified thickness,or
or oiled. At the producer's option, bars may be cleaned,diameter, or fraction thereof, over 2 in. [50 mm] in diameter,
for inspection.,or thickness, to a maximum deduction of 3%.,
,7.1.2 Test Specimens:,
6. Chemical Composition,7.1.2.1 Test specimens shall be prepared for test­,
,ing from the material in its as-rolled condition unless other­,
6.1 The steel shall conform to the chemical require­,,
,wise specified (see Supplementary Requirements). The,
ments specified in Table 2.,,
,tension specimen may be aged as described in Test Meth­,
6.2 Leaded Steel - When required, lead may be speci­,ods and Definitions A 370.,
fied as an added element. When lead is specified as an,,
,7.1.2.2 Test specimens shall be taken longitudi­,
added element, a range from 0.15 to 0.35 % inclusive shall,,
,nally and may be tested in full thickness or section, or they,
be furnished. Such a steel is identified by adding the letter,,
,may be machined to the dimensions shown in Fig. 4 or,
L after the grade designation, for example 60L [415L].,,
,Fig. 5 of Test Methods and Definitions A 370. If test speci­,
6.3 Copper-Bearing Steel - When required copper may,mens are selected conforming to the dimensions of Fig. 5,,
be specified as an added element. Copper-bearing steel is,they shall be machined from a position midway between,
