end specimens, no serious die marks, scratches, or other,
continuous surface imperfections shall be present. Based upon,
examination of etched-end specimen, seams shall not exceed,
,TABLE 3 Permissible Variations in Wire Diameter4
3.5 % of the wire diameter, or 0.25 mm [0.010 in.], whichever,
is the smaller as measured on a transverse section.,SI Units
8.1.2 Number of Tests-For the purpose of examination of,Permissible Diameter Permissible Out-
,Variations, ±mm of-Round
etched-end specimens, one test specimen shall be taken for,
each 10 coils, or fraction thereof, in a lot. Each cast or heat in,0.80 to 2.00, incl 0.03 0.03
a given lot shall be tested.,Over 2.00 to 11.0, incl 0.05 0.05
,Over 11.00 0.07 0.07
8.1.3 Location of Test-Test specimens shall be taken from,
,Inch-Pound Units
either or both ends of the coil.,
8.1.4 Test Method-The surface shall be examined after,Permissible Diameter Permissible Out­
,Variations, +in. of-Round
etching in a solution of equal parts of hydrochloric acid and,
water that has been heated to approximately 80°C for up to two,0.032 to 0.075, incl 0.001 0.001
minutes in order to remove the oxide scale layer from the wire,Over 0.075 to 0.438, incl 0.002 0.002
,Over 0.438 0.003 0.003
