allowed between the measurement made before loading and,considered conforming to the tensile strength requirement and,
that made after loading. Variables, such as straightness and,in addition to the tensile strength, the failure mode shall be
thread alignment (plus measurement e1rnr), may result in,reported to the purchaser. If it is necessary to record or report
apparent elongation of the fasteners when the proof load is,the tensile strength of bolts as psi values, the stress area shall
initially applied. In such cases, the fastener may be retested,be calculated from the mean of the mean root and pitch
using a 3 % greater load, and may be considered satisfactory if,diameters of Class 3 external threads as follows:
the length after this loading is the same as before this loading,A,= 0.7854 [D - (0.9743/n)] 2 (A3.l)
(within the 0.0005-in. tolerance for measurement error).,
A3.2. l .3 Proof Load-Time of Loading-The proof load is to,where:
be maintained for a period of 10 s before release of load, when,As = stress area, in.2,
using Method 1.,D = nominal diameter, in., and
(1) Method 2, Yield Strength-The bolt shall be assembled,n = number of threads per in.
in the testing equipment as outlined in A3.2.l.4. As the load is,A3.2.l.5 Tension Testing of Full-size Bolts with a Wedge­
applied, tl1e total elongation of the bolt or any part of the bolt,The purpose of this test is to obtain the tensile strength and
which includes the exposed six threads shall be measured and,demonstrate the "head quality" and ductility of a bolt with a
recorded to produce a load-strain or a stress-strain diagram.,standard head by subjecting it to eccentric loading. The
The load or stress at an offset equal to 0.2 % of the length of,ultimate load on the bolt shall be determined as described in
bolt occupied by six full threads shall be determined by the,A3.2.1.4, except that a 10° wedge shall be placed under the
method described in 14.2.1 of these methods, A370. This load,same bolt previously tested for the proof load (see A3.2.1.1).
or stress shall not be less than that prescribed in the product,The bolt head shall be so placed that no comer of the hexagon
specification.,or square takes a bearing load, that is, a flat of the head shall
A3.2.l.4 Axial Tension Testing of Full Size Bolts-Bolts,be aligned with the direction of uniform thickness of the wedge
are to be tested in a holder with the load axially applied,(see Fig. A3.2). The wedge shall have an included angle
between the head and a nut or suitable fixture (see Fig. A3.l),,between its faces as shown in Table A3.1 and shall have a
either of which shall have sufficient thread engagement to,thickness of one-half of the nominal bolt diameter at the short
,side of the hole. The hole in the wedge shall have the following
,clearance over the nominal size of the bolt, and its edges, top
,and bottom, shall be rounded to the following radius:
,Clearance in Hole, Radius on Corners of
,Nominal Bolt Size, in. in. (mm) Hole, in. (mm)
,1⁄4 to 1⁄2 0.030 (0.76) 0.030 (0.76)
,9/,a to 3⁄4 0.050 (1.3) 0.060 (1.5)
,7/s to 1 0.063 (1.5) 0.060 (1.5)
,11/s to 11⁄4 0.063 (1.5) 0.125 (3.2)
,13/s to 11⁄2 0.094 (2.4) 0.125 (3.2)
