,casting, including dimensions of all areas not examined
S1.2.1.1 Resolve and mark the amplitudes of the,
1⁄4t and 1⁄2t side-drilled holes from the same surface. The,due to geometric configuration, with the location of all
side-drilled hole used for the 1⁄4t amplitude may be used,indications in accordance with S1.3.1.
to establish the 3⁄4t amplitude from the opposite surface or,S1.4 Acceptance Standards - Acceptance quality lev­
a separate hole may be used.,els shall be established between the purchaser and the
S1.2.1.2 Connect the 1⁄4t, 1⁄2t, and 3⁄4t amplitudes to,manufacturer on the basis of one or more of the following
establish the applicable DAC.,criteria:
S1.2.2 The basic calibration blocks shall be made,S1.4.1 No indication equal to or greater than the
of material that is acoustically similar to the casting being,DAC over an area specified for the applicable quality level
