ments for the purpose of improving the machinability of the,,,result of differences in alloy content, heat treatment, or microporosity.
,,,When density values are measured that are less than the density typical of
compact shall not be permitted.,,,
,,,a class of grades, it is appropriate to examine the sample for microporosity
6.3 The steel shall not contain an unspecified element other,,,by the more specific metallographic examination procedures.
than nitrogen, for the ordered grade, to the extent that the steel,,,8.1.2 Microstructural Examination:
conforms to the requirements of another grade for which that,,,8.1.2.1 The microstructure shall be examined at 20-50x,
element is a specified element having,,a required minimum,100-200x, and 1000-2000x and shall be reasonably uniform
content.,,,and shall be free of voids, laps, cracks, and porosity.
,,,8.1.2.2 One sample from each production lot shall be
7. Heat Treatment,,,
,,,examined. The sample shall be taken after hot-isostatic press­
7.1 Except as provided in 7.2, the final heat treatment of all,,,ing or after final heat treatment. The sample shall be taken from
parts shall be in compliance with the requirements of Table 2.,,,the component, stem, protrusion, or test part made from a
After hot isostatic-pressing and prior to final heat treatment, the,,,single powder blend consolidated in the same hot isostatic
compacts are permitted to be annealed,,,at the option of the,press using the same pressure, temperature, and time param­
producer, either as a part of the consolidation process or as a,,,eters and heat-treated in the same final heat-treatment charge.
separate operation.,,,The microstructure shall meet the requirements of 8.1.2.1.
7.2 When agreed upon by the purchaser, liquid quenching,,,8.1.2.3 If the sample fails to meet the requirements for
may be applied to the martensitic stainless steels in place of the,,,acceptance, each part in the lot is permitted to be retested and
furnace cool or air cool specified in Table 2, provided that such,,,those that pass shall be accepted.
quenching is followed by tempering in the temperature ranges,,,8.2 Hydrostatic Tests-After they have been machined,
as required in Table 2.,Martensitic,parts that are liquid,pressure-containing parts shall be tested to the hydrostatic shell
quenched and tempered shall be marked "QT.",,,test pressures prescribed in ASME B16.5 for the applicable
7.3 The final heat treatment shall be performed before or,,,steel rating for which the part is designed and shall show no
after machining at the option of the producer.,,,leaks. Parts ordered under these specifications for working
pressures other than those listed in the ASME B16.5 ratings 7.4 See Section S16 if a particular heat treatment method is,,,
specified by the purchaser in the purchase order.,,,shall be tested to such pressures as may be agreed upon
,,,between the manufacturer and purchaser.
8. Structural Integrity Requirements,,,8.2.l No hydrostatic test is required for weld neck or other
8.1 Microporosity-The parts shall be free of microporosity,,,flanges.
as demonstrated by measurement of density,,as provided in,8.2.2 The compact manufacturer is not required to perfmm
8.1.1 or by microstructural examination as provided in 8.1.2.,,,pressure tests on rough parts that are to be finish machined by
8.1.1 Density Measurement:,,,others. The fabricator of the finished part is not required to
8 .1.1.1 The density measurement shall be used for accep­,,,pressure test parts that are designed to be pressure containing
tance of material but not,for rejection,of material. The,only after assembly by welding into a larger structure. The
measured density for each production lot shall exceed 99 % of,,,manufacturer of the compacts, however, shall be responsible,
the density typical of that grade when wrought and in the same,,,as required in 16.1 for the satisfactory performance of the parts
heat treated condition as the sample. A production lot that fails,,,under the final test required in 8.2.
to meet this acceptance criterion is permitted to be tested at the,,,8.3 Ultrasonic Tests-When specified in the order,
option of the producer, for microporosity in accordance with,,,austenitic-ferritic stainless steel parts made from S32505 shall
the microstructural examination as provided in 8.1.2.,,,be ultrasonic tested according to the procedures described in
8.1.1.2 Density shall be determined for,,one sample from,Section S7.
each production lot by measuring the difference in mass of the,,,
sample when weighed in air and when weighed in water and,,,9. Mechanical Properties
multiplying this difference,by the,density of water (Archi­,
,,,9 .1 The mate1ial shall conform to the requirements for
mede' s principle). The equipment used,,shall be capable of,
,,,mechanical properties prescribed in Table 3 at room tempera­
determining density within,±0.004,lb/in.3 [0.10 g/cm3].,
,,,ture.
Alternatively, at the option of the producer, it is permitted to,,,
use Test Method B311 to determine the density.,,,9.2 Sample shall be from the component, stem, protrusion,
8.1.1.3 At the option of the producer, the density shall be,,,or test part made from a single powder blend consolidated in
compared to the room temperature density typical of wrought,,,the same hot isostatic press using the same pressure,
steels of the same class of grades, 0.28 lb/in.3 [7.8 g/cm3],,for,temperature, and time parameters and heat-treated in the same
age-hardening, martensitic, and austenitic-ferritic grades, and,,,final heat-treatment charge. If repair welding is required (See
