the applicable specifications. Data submitted on three,area (when specified in the material specification), and
heats of one wrought product form for which coverage,elongation. For steels, nickel alloys, cobalt alloys, and alu­
is requested may be considered to be applicable for all,minum alloys, data shall be provided at room tempera­
other wrought product forms having the same nominal,ture and 100°F (50°C) intervals, beginning at 200°F
composition. Testing shall include the characterization,(100°C) to 100°F (50°C) above the maximum intended
of the metallurgical structure, including determination,use temperature, unless the maximum intended use tem­
of grain size.,perature does not exceed 100°F (4 0°C). For copper alloys,
For wrought materials and especially for those materi­,titanium alloys, and zirconium alloys, data shall be pro­
als whose mechanical properties are enhanced by heat,vided at room temperature, 150°F (65°C), and 200°F
treatment, forming practices, or a combination thereof,,(100°C), and then at 100°F (50°C) intervals, to 100°F
and for other materials for which the mechanical proper­,(50°C) above the maximum intended use temperature,
ties may be reasonably expected to be thickness depen­,unless the maximum intended use temperature does not
dent, data from one additional lot from material of at,exceed 100°F (4 0°C). The test methods shall be as given
least 75% of the maximum thickness for which coverage,in ASTM A370, ASTM A1058, ASTM E8, ASTM E21, or
is requested shall be submitted. If no maximum thickness,other equivalent national or international test standards.
is given, information shall be provided to support the suit­,In addition, when specified in the material specification,
ability of the thickness used for the tested samples.,hardness values shall be provided at room temperature
When adoption of cast product forms is requested, data,and shall be determined as specified in the material spec­
from at least three heats for one of the cast product forms,ification. Data provided shall be expressed in the units
shall be submitted. The cast material shall be considered,and to the number of significant figures shown in Table
as a separate material even if its nominal composition is,IV-800-1. When either the material specification or the
the same or very similar to that of an approved wrought,applicable construction code ( e.g., Section XII) permits
material.,or requires that yield strength be determined by other
If the hot isostatically pressed powder material meets,than the 0.2% offset method, those other yield strength
all of the requirements of Table IV-100-1, it shall be con­,values shall also be reported.
sidered the same material as that of the approved,
wrought material for temperatures approximately 50°F,
(25°C) below the temperature where time-dependent,IV-900 TIME-DEPENDENT PROPERTIES
properties, as defined by the Time-Dependent Properties,If approval is desired for temperatures where time­
Notes (T-Notes) in the applicable allowable stress table,dependent properties may be expected to control design,
for the approved wrought material, govern.,time-dependent data, as itemized below, shall be pro­
If the hot isostatically pressed material is to be used at,vided, starting at temperatures approximately 50°F
temperatures where the time-dependent properties, as,(25°C) below the temperature where time-dependent
defined by the Time-Dependent Properties Notes,properties may govern and extending at least 100°F
(T-Notes) in the applicable allowable stress table for the,(S0°C) above the maximum intended use temperature.
approved wrought material, govern, the requirements of,Exceptions to this rule are permitted, provided the in­
this Appendix relative to the provision of data for new,quirer provides suitable justification for the deviation.
materials shall apply.,The creep-rupture test method shall be in accordance
If the hot isostatically pressed powder material does,with ASTM E139 or other equivalent national or interna­
not meet all of the requirements of Table IV-100-1, it shall,tional test standard.For time-dependent tests, the interval
be considered as a separate material to that of the ap­,between successive temperatures shall be chosen such
proved wrought material. In this case, the requirements,that it permits, in all cases, an accurate estimation of
of this Appendix relative to the provision of data for,the slope of the stress-rupture curves. For normally stable
